{
  "net": "NEW-ENGLAND-5",
  "total": 100,
  "page": 0,
  "records": [
    {
      "range": "24.62.0.0/15",
      "id": "",
      "name": "Comcast Cable Communications Holdings, Inc",
      "country": "US",
      "org": "POC object or null",
      "admin": "POC object or null",
      "abuse": "POC object or null",
      "tech": "POC object or null",
      "maintainer": "POC object or null",
      "updated": "2010-10-18",
      "status": "REASSIGNMENT",
      "source": "arin",
      "raw": "<raw data>"
    }
  ]
}